{
  "$schema": "https://json-schema.org/draft/2020-12/schema",
  "type": "object",
  "additionalProperties": false,
  "required": ["schemaVersion", "contractVersion", "packages", "platforms", "canonicalSample", "defaults", "native", "startup", "webView", "verification"],
  "properties": {
    "$schema": { "const": "flat-ui.mobile.contract.schema.json" },
    "schemaVersion": { "const": "3.1" },
    "contractVersion": { "const": "2.2.1" },
    "packages": {
      "const": {
        "Microsoft.Maui.Controls": "10.0.90",
        "Opx.MudBlazor.FlatUi": "2.2.1",
        "MudBlazor": "9.10.0",
        "CommunityToolkit.Maui": "15.0.1"
      }
    },
    "platforms": { "const": ["Android", "iOS"] },
    "canonicalSample": {
      "const": {
        "mode": "exact-initial-baseline",
        "auditSwitch": "-ExactSample",
        "lineEndingNormalization": "LF",
        "namespaceNormalization": "Opx.MudBlazor.FlatUi.Maui.Template",
        "promptTriggers": ["sama", "persis", "canonical", "seperti sample", "source of truth"],
        "files": {
          "Components/_Imports.razor": "22BA9D3C78BF7BD40A1C8B5460E27B9226908CAF769D508D899222A56FD570B3",
          "Components/Layout/MainLayout.razor": "BDD9FFF00DF7AA7ED01F3C8D11637568A542F9DFCA74F48BBBDFF3AA5C81C5A3",
          "Components/Layout/MobileSidebarMenu.razor": "DD3CA98750144D20B90615556E72009E948AA2E6D69E7C1C3A8D9D14EC705FED",
          "Components/Pages/Home.razor": "8AF7B2D7A3DD7625ED09D8157368FA9481F62FFEA32890D6901941E8B09656A5",
          "Components/RootStartupGate.razor": "B16425B1B88AAE60091BD24AC4877EFCE78DFDF6053F560CA4D78AE99A4AB939",
          "MauiProgram.cs": "DB63AA10050CD8ACF5F6EB1ED5ADEBAA54E99B24A48494B6B5AB48E1DE9D49FB",
          "MainPage.xaml": "5E0FD69C86C9A67BCA5C705E4CB1EAA632801773567E7A36A1342C496CB54108",
          "Platforms/Android/AndroidManifest.xml": "99473DD217AFF65C62A3198157E794674190858388530E0E3C074FEF63227F56",
          "Resources/Splash/splash.svg": "2CE5A083499E8A1FB0CD3E81FC6D029563B821C8B63960552F8593A35600821F",
          "appsettings.json": "563FFB0C899179C76612420CFF9035F1AE418418E64A89C580A2BD3BD8A241D5",
          "wwwroot/app.css": "92FA657E143FAF00348F4E5CEF9CE806F5FBE1D8CB37E45863DE759194B94DDB"
        },
        "allowedAfterBaseline": ["branding", "wording", "data", "authorization", "callbacks", "domain-integration", "persistence"],
        "visualDriftRequiresExplicitDecision": true
      }
    },
    "defaults": { "const": { "theme": "Light", "appBarSearchVisible": true, "fontOwnership": "Device", "useAppFontSize": false, "panelHeaderMinHeightPx": 48, "panelHeaderPaddingYPx": 10, "defaultRoundedSizePx": 7, "defaultColorPalette": "fluent-blue", "defaultDensity": "Default", "navigationLayout": "Bottom", "defaultBottomNavigationChildPresentation": "Sheet", "mobileToolbarActionsExpandedByDefault": false, "bottomNavigationMaxWidthPx": 900 } },
    "native": { "const": { "toolkitRegistration": "UseMauiCommunityToolkit", "statusBarBehavior": true, "statusBarMatchesResolvedAppBar": true, "iosViewControllerBasedStatusBarAppearance": false, "androidOverScrollMode": "Never", "androidDeclaredPermissions": ["android.permission.INTERNET", "android.permission.ACCESS_NETWORK_STATE", "android.permission.POST_NOTIFICATIONS"], "defaultDotNetSplashArtworkVisible": false, "neutralSplashSurface": "#FFFFFF", "backBehavior": { "precedence": ["topmost-modal-overlay", "previous-blazor-history", "native-host-fallback"], "modalBackKeepsCurrentRoute": true, "modalBackKeepsApplicationAlive": true, "nativeExitRequiresEmptyOverlayAndHistory": true }, "iosBounces": false, "iosAlwaysBounceVertical": false } },
    "startup": { "const": { "rootGateBeforeRouter": true, "staticLoadingBeforeInteractive": true, "title": "Memuat", "spinnerClass": "flat-system-loading-spinner", "protectedLayoutFlashForbidden": true } },
    "webView": { "const": { "rootOverscrollBehavior": "none", "ordinaryTextSelectable": false, "textboxSelectionPreserved": true, "reusableCssFromPackageOnly": true, "opxPackageCssSha256": "71BF6AE517ED4292944710BA144666DBABF9AF4FAB3E5959B6642F8F49F63CEA" } },
    "verification": { "const": { "androidReleaseBuildRequired": true, "androidDeviceEvidenceRequiredForNativeClaims": true, "iosDeviceEvidenceRequiredForNativeClaims": true } }
  }
}
